{
  "ctf": {
    "name": "Athena CTF",
    "domain": "athena.io",
    "description": "Athena is a hosted platform for CTFs",
    "time": {
      "end": "2024-12-16T09:14:01.680914361Z",
      "start": "2024-12-14T09:14:01.680936432Z",
      "freeze": "2024-12-17T09:14:01.680935501Z"
    },
    "sponsors": {},
    "prizes": {},
    "levels": [
      {
        "value": 1,
        "name": "Very Easy",
        "color": "#23332b"
      },
      {
        "value": 2,
        "name": "Easy",
        "color": "#059c50"
      },
      {
        "value": 3,
        "name": "Medium",
        "color": "#d0d40f"
      },
      {
        "value": 4,
        "name": "Hard",
        "color": "#d4290f"
      }
    ]
  },
  "database": {
    "host": "postgres",
    "port": 5432,
    "username": "postgres",
    "password": "MCI8skXf6XUf",
    "listener_channel": "athena_db_modification",
    "database_name": "athena_db"
  },
  "redis": {
    "host": "redis",
    "port": 6379,
    "username": "redis",
    "password": "UEciEdQCneRb"
  },
  "file_storage": {
    "local": {
      "compress": "gzip",
      "path": "/var/athena/static"
    }
  },
  "jwt": {
    "secret": "yMrBMt2NWi0+q9BBvI97uUy8gFxLL4UzMTO0gDKLzBU=",
    "access_expiry_duration": 600,
    "refresh_expiry_duration": 86400
  },
  "smtp": {
    "from": "noreply@athena.io",
    "reply_to": "admin@athena.io",
    "username": "athena_smtp",
    "password": "eyhKJEOBukMB",
    "server_url": "smtp.athena.io"
  },
  "docker": {
    "registry_url": "registry.athena.io",
    "registry_username": "athena",
    "registry_password": "NVSudnELeVV1"
  },
  "discord": {
    "welcome_channel_id": "",
    "editor_role_id": "",
    "viewer_role_id": "",
    "reaction_role_message_id": "",
    "logs_channel_id": "",
    "general_channel_id": "",
    "bot_token": ""
  },
  "token": {
    "max_retries": 10,
    "token_expiry_in_secs": 3600
  },
  "challenge": {
    "container_registry": "registry.athena.io",
    "registry_username": "athena",
    "registry_password": "4ZkXLSlmc3NB",
    "container_timeout": 900,
    "player_flag_len": 20
  }
}